No.     Time           Source                Destination           Protocol Length Info
      1 0.000000       192.168.0.10          64.233.167.188        TCP      55     53116 → 5228 [ACK] Seq=1 Ack=1 Win=256 Len=1

Frame 1: 55 bytes on wire (440 bits), 55 bytes captured (440 bits) on interface 0
Ethernet II, Src: IntelCor_c8:b2:94 (9c:4e:36:c8:b2:94), Dst: Sagemcom_00:48:fc (a0:8e:78:00:48:fc)
Internet Protocol Version 4, Src: 192.168.0.10, Dst: 64.233.167.188
Transmission Control Protocol, Src Port: 53116, Dst Port: 5228, Seq: 1, Ack: 1, Len: 1
Data (1 byte)

0000  00                                                .

No.     Time           Source                Destination           Protocol Length Info
      2 0.018280       64.233.167.188        192.168.0.10          TCP      66     5228 → 53116 [ACK] Seq=1 Ack=2 Win=180 Len=0 SLE=1 SRE=2

Frame 2: 66 bytes on wire (528 bits), 66 bytes captured (528 bits) on interface 0
Ethernet II, Src: Sagemcom_00:48:fc (a0:8e:78:00:48:fc), Dst: IntelCor_c8:b2:94 (9c:4e:36:c8:b2:94)
Internet Protocol Version 4, Src: 64.233.167.188, Dst: 192.168.0.10
Transmission Control Protocol, Src Port: 5228, Dst Port: 53116, Seq: 1, Ack: 2, Len: 0

No.     Time           Source                Destination           Protocol Length Info
      3 2.537317       192.168.0.1           239.255.255.250       SSDP     381    NOTIFY * HTTP/1.1 

Frame 3: 381 bytes on wire (3048 bits), 381 bytes captured (3048 bits) on interface 0
Ethernet II, Src: Sagemcom_00:48:fc (a0:8e:78:00:48:fc), Dst: IntelCor_c8:b2:94 (9c:4e:36:c8:b2:94)
Internet Protocol Version 4, Src: 192.168.0.1, Dst: 239.255.255.250
User Datagram Protocol, Src Port: 1900, Dst Port: 1900
Simple Service Discovery Protocol

No.     Time           Source                Destination           Protocol Length Info
      4 2.543241       192.168.0.1           239.255.255.250       SSDP     326    NOTIFY * HTTP/1.1 

Frame 4: 326 bytes on wire (2608 bits), 326 bytes captured (2608 bits) on interface 0
Ethernet II, Src: Sagemcom_00:48:fc (a0:8e:78:00:48:fc), Dst: IntelCor_c8:b2:94 (9c:4e:36:c8:b2:94)
Internet Protocol Version 4, Src: 192.168.0.1, Dst: 239.255.255.250
User Datagram Protocol, Src Port: 1900, Dst Port: 1900
Simple Service Discovery Protocol

No.     Time           Source                Destination           Protocol Length Info
      5 2.543242       192.168.0.1           239.255.255.250       SSDP     317    NOTIFY * HTTP/1.1 

Frame 5: 317 bytes on wire (2536 bits), 317 bytes captured (2536 bits) on interface 0
Ethernet II, Src: Sagemcom_00:48:fc (a0:8e:78:00:48:fc), Dst: IntelCor_c8:b2:94 (9c:4e:36:c8:b2:94)
Internet Protocol Version 4, Src: 192.168.0.1, Dst: 239.255.255.250
User Datagram Protocol, Src Port: 1900, Dst Port: 1900
Simple Service Discovery Protocol

No.     Time           Source                Destination           Protocol Length Info
      6 2.543243       192.168.0.1           239.255.255.250       SSDP     391    NOTIFY * HTTP/1.1 

Frame 6: 391 bytes on wire (3128 bits), 391 bytes captured (3128 bits) on interface 0
Ethernet II, Src: Sagemcom_00:48:fc (a0:8e:78:00:48:fc), Dst: IntelCor_c8:b2:94 (9c:4e:36:c8:b2:94)
Internet Protocol Version 4, Src: 192.168.0.1, Dst: 239.255.255.250
User Datagram Protocol, Src Port: 1900, Dst Port: 1900
Simple Service Discovery Protocol

No.     Time           Source                Destination           Protocol Length Info
      7 5.091030       192.168.0.1           224.0.0.1             IGMPv3   46     Membership Query, general

Frame 7: 46 bytes on wire (368 bits), 46 bytes captured (368 bits) on interface 0
Ethernet II, Src: Sagemcom_00:48:fc (a0:8e:78:00:48:fc), Dst: IPv4mcast_01 (01:00:5e:00:00:01)
Internet Protocol Version 4, Src: 192.168.0.1, Dst: 224.0.0.1
Internet Group Management Protocol

No.     Time           Source                Destination           Protocol Length Info
      8 13.282494      192.168.0.5           239.255.255.250       SSDP     368    NOTIFY * HTTP/1.1 

Frame 8: 368 bytes on wire (2944 bits), 368 bytes captured (2944 bits) on interface 0
Ethernet II, Src: Sagemcom_00:48:fd (a0:8e:78:00:48:fd), Dst: IntelCor_c8:b2:94 (9c:4e:36:c8:b2:94)
Internet Protocol Version 4, Src: 192.168.0.5, Dst: 239.255.255.250
User Datagram Protocol, Src Port: 1900, Dst Port: 1900
Simple Service Discovery Protocol

No.     Time           Source                Destination           Protocol Length Info
      9 13.330027      192.168.0.5           239.255.255.250       SSDP     359    NOTIFY * HTTP/1.1 

Frame 9: 359 bytes on wire (2872 bits), 359 bytes captured (2872 bits) on interface 0
Ethernet II, Src: Sagemcom_00:48:fd (a0:8e:78:00:48:fd), Dst: IntelCor_c8:b2:94 (9c:4e:36:c8:b2:94)
Internet Protocol Version 4, Src: 192.168.0.5, Dst: 239.255.255.250
User Datagram Protocol, Src Port: 1900, Dst Port: 1900
Simple Service Discovery Protocol

No.     Time           Source                Destination           Protocol Length Info
     10 13.377482      192.168.0.5           239.255.255.250       SSDP     411    NOTIFY * HTTP/1.1 

Frame 10: 411 bytes on wire (3288 bits), 411 bytes captured (3288 bits) on interface 0
Ethernet II, Src: Sagemcom_00:48:fd (a0:8e:78:00:48:fd), Dst: IntelCor_c8:b2:94 (9c:4e:36:c8:b2:94)
Internet Protocol Version 4, Src: 192.168.0.5, Dst: 239.255.255.250
User Datagram Protocol, Src Port: 1900, Dst Port: 1900
Simple Service Discovery Protocol

No.     Time           Source                Destination           Protocol Length Info
     11 13.424746      192.168.0.5           239.255.255.250       SSDP     423    NOTIFY * HTTP/1.1 

Frame 11: 423 bytes on wire (3384 bits), 423 bytes captured (3384 bits) on interface 0
Ethernet II, Src: Sagemcom_00:48:fd (a0:8e:78:00:48:fd), Dst: IntelCor_c8:b2:94 (9c:4e:36:c8:b2:94)
Internet Protocol Version 4, Src: 192.168.0.5, Dst: 239.255.255.250
User Datagram Protocol, Src Port: 1900, Dst Port: 1900
Simple Service Discovery Protocol

No.     Time           Source                Destination           Protocol Length Info
     12 13.472184      192.168.0.5           239.255.255.250       SSDP     425    NOTIFY * HTTP/1.1 

Frame 12: 425 bytes on wire (3400 bits), 425 bytes captured (3400 bits) on interface 0
Ethernet II, Src: Sagemcom_00:48:fd (a0:8e:78:00:48:fd), Dst: IntelCor_c8:b2:94 (9c:4e:36:c8:b2:94)
Internet Protocol Version 4, Src: 192.168.0.5, Dst: 239.255.255.250
User Datagram Protocol, Src Port: 1900, Dst Port: 1900
Simple Service Discovery Protocol

No.     Time           Source                Destination           Protocol Length Info
     13 13.523174      192.168.0.5           239.255.255.250       SSDP     439    NOTIFY * HTTP/1.1 

Frame 13: 439 bytes on wire (3512 bits), 439 bytes captured (3512 bits) on interface 0
Ethernet II, Src: Sagemcom_00:48:fd (a0:8e:78:00:48:fd), Dst: IntelCor_c8:b2:94 (9c:4e:36:c8:b2:94)
Internet Protocol Version 4, Src: 192.168.0.5, Dst: 239.255.255.250
User Datagram Protocol, Src Port: 1900, Dst Port: 1900
Simple Service Discovery Protocol

No.     Time           Source                Destination           Protocol Length Info
     14 18.627064      192.168.0.10          89.2.0.1              DNS      87     Standard query 0xdeb8 A mirror.toolbar.netcraft.com

Frame 14: 87 bytes on wire (696 bits), 87 bytes captured (696 bits) on interface 0
Ethernet II, Src: IntelCor_c8:b2:94 (9c:4e:36:c8:b2:94), Dst: Sagemcom_00:48:fc (a0:8e:78:00:48:fc)
Internet Protocol Version 4, Src: 192.168.0.10, Dst: 89.2.0.1
User Datagram Protocol, Src Port: 60778, Dst Port: 53
Domain Name System (query)

No.     Time           Source                Destination           Protocol Length Info
     15 18.627222      192.168.0.10          89.2.0.1              DNS      77     Standard query 0x2309 A www.mediafire.com

Frame 15: 77 bytes on wire (616 bits), 77 bytes captured (616 bits) on interface 0
Ethernet II, Src: IntelCor_c8:b2:94 (9c:4e:36:c8:b2:94), Dst: Sagemcom_00:48:fc (a0:8e:78:00:48:fc)
Internet Protocol Version 4, Src: 192.168.0.10, Dst: 89.2.0.1
User Datagram Protocol, Src Port: 49745, Dst Port: 53
Domain Name System (query)

No.     Time           Source                Destination           Protocol Length Info
     16 18.636011      89.2.0.1              192.168.0.10          DNS      190    Standard query response 0xdeb8 A mirror.toolbar.netcraft.com CNAME 26015a32-oc.mi-cdn.io CNAME cds.z5j3e5y7.hwcdn.net A 69.16.175.10 A 69.16.175.42

Frame 16: 190 bytes on wire (1520 bits), 190 bytes captured (1520 bits) on interface 0
Ethernet II, Src: Sagemcom_00:48:fc (a0:8e:78:00:48:fc), Dst: IntelCor_c8:b2:94 (9c:4e:36:c8:b2:94)
Internet Protocol Version 4, Src: 89.2.0.1, Dst: 192.168.0.10
User Datagram Protocol, Src Port: 53, Dst Port: 60778
Domain Name System (response)

No.     Time           Source                Destination           Protocol Length Info
     17 18.636785      192.168.0.10          69.16.175.10          TCP      66     64239 → 80 [SYN] Seq=0 Win=64240 Len=0 MSS=1460 WS=256 SACK_PERM=1

Frame 17: 66 bytes on wire (528 bits), 66 bytes captured (528 bits) on interface 0
Ethernet II, Src: IntelCor_c8:b2:94 (9c:4e:36:c8:b2:94), Dst: Sagemcom_00:48:fc (a0:8e:78:00:48:fc)
Internet Protocol Version 4, Src: 192.168.0.10, Dst: 69.16.175.10
Transmission Control Protocol, Src Port: 64239, Dst Port: 80, Seq: 0, Len: 0

No.     Time           Source                Destination           Protocol Length Info
     18 18.640232      89.2.0.1              192.168.0.10          DNS      109    Standard query response 0x2309 A www.mediafire.com A 205.196.120.6 A 205.196.120.8

Frame 18: 109 bytes on wire (872 bits), 109 bytes captured (872 bits) on interface 0
Ethernet II, Src: Sagemcom_00:48:fc (a0:8e:78:00:48:fc), Dst: IntelCor_c8:b2:94 (9c:4e:36:c8:b2:94)
Internet Protocol Version 4, Src: 89.2.0.1, Dst: 192.168.0.10
User Datagram Protocol, Src Port: 53, Dst Port: 49745
Domain Name System (response)

No.     Time           Source                Destination           Protocol Length Info
     19 18.640845      192.168.0.10          205.196.120.6         TCP      66     64240 → 443 [SYN] Seq=0 Win=64240 Len=0 MSS=1460 WS=256 SACK_PERM=1

Frame 19: 66 bytes on wire (528 bits), 66 bytes captured (528 bits) on interface 0
Ethernet II, Src: IntelCor_c8:b2:94 (9c:4e:36:c8:b2:94), Dst: Sagemcom_00:48:fc (a0:8e:78:00:48:fc)
Internet Protocol Version 4, Src: 192.168.0.10, Dst: 205.196.120.6
Transmission Control Protocol, Src Port: 64240, Dst Port: 443, Seq: 0, Len: 0

No.     Time           Source                Destination           Protocol Length Info
     20 18.645202      69.16.175.10          192.168.0.10          TCP      66     80 → 64239 [SYN, ACK] Seq=0 Ack=1 Win=14600 Len=0 MSS=1460 SACK_PERM=1 WS=512

Frame 20: 66 bytes on wire (528 bits), 66 bytes captured (528 bits) on interface 0
Ethernet II, Src: Sagemcom_00:48:fc (a0:8e:78:00:48:fc), Dst: IntelCor_c8:b2:94 (9c:4e:36:c8:b2:94)
Internet Protocol Version 4, Src: 69.16.175.10, Dst: 192.168.0.10
Transmission Control Protocol, Src Port: 80, Dst Port: 64239, Seq: 0, Ack: 1, Len: 0

No.     Time           Source                Destination           Protocol Length Info
     21 18.645325      192.168.0.10          69.16.175.10          TCP      54     64239 → 80 [ACK] Seq=1 Ack=1 Win=65536 Len=0

Frame 21: 54 bytes on wire (432 bits), 54 bytes captured (432 bits) on interface 0
Ethernet II, Src: IntelCor_c8:b2:94 (9c:4e:36:c8:b2:94), Dst: Sagemcom_00:48:fc (a0:8e:78:00:48:fc)
Internet Protocol Version 4, Src: 192.168.0.10, Dst: 69.16.175.10
Transmission Control Protocol, Src Port: 64239, Dst Port: 80, Seq: 1, Ack: 1, Len: 0

No.     Time           Source                Destination           Protocol Length Info
     22 18.645647      192.168.0.10          69.16.175.10          HTTP     396    GET /check_url/v2/https://www.mediafire.com HTTP/1.1 

Frame 22: 396 bytes on wire (3168 bits), 396 bytes captured (3168 bits) on interface 0
Ethernet II, Src: IntelCor_c8:b2:94 (9c:4e:36:c8:b2:94), Dst: Sagemcom_00:48:fc (a0:8e:78:00:48:fc)
Internet Protocol Version 4, Src: 192.168.0.10, Dst: 69.16.175.10
Transmission Control Protocol, Src Port: 64239, Dst Port: 80, Seq: 1, Ack: 1, Len: 342
Hypertext Transfer Protocol

No.     Time           Source                Destination           Protocol Length Info
     23 18.655672      69.16.175.10          192.168.0.10          TCP      60     80 → 64239 [ACK] Seq=1 Ack=343 Win=15872 Len=0

Frame 23: 60 bytes on wire (480 bits), 60 bytes captured (480 bits) on interface 0
Ethernet II, Src: Sagemcom_00:48:fc (a0:8e:78:00:48:fc), Dst: IntelCor_c8:b2:94 (9c:4e:36:c8:b2:94)
Internet Protocol Version 4, Src: 69.16.175.10, Dst: 192.168.0.10
Transmission Control Protocol, Src Port: 80, Dst Port: 64239, Seq: 1, Ack: 343, Len: 0

No.     Time           Source                Destination           Protocol Length Info
     24 18.761261      205.196.120.6         192.168.0.10          TCP      62     443 → 64240 [SYN, ACK] Seq=0 Ack=1 Win=64240 Len=0 MSS=1460 SACK_PERM=1

Frame 24: 62 bytes on wire (496 bits), 62 bytes captured (496 bits) on interface 0
Ethernet II, Src: Sagemcom_00:48:fc (a0:8e:78:00:48:fc), Dst: IntelCor_c8:b2:94 (9c:4e:36:c8:b2:94)
Internet Protocol Version 4, Src: 205.196.120.6, Dst: 192.168.0.10
Transmission Control Protocol, Src Port: 443, Dst Port: 64240, Seq: 0, Ack: 1, Len: 0

No.     Time           Source                Destination           Protocol Length Info
     25 18.761401      192.168.0.10          205.196.120.6         TCP      54     64240 → 443 [ACK] Seq=1 Ack=1 Win=64240 Len=0

Frame 25: 54 bytes on wire (432 bits), 54 bytes captured (432 bits) on interface 0
Ethernet II, Src: IntelCor_c8:b2:94 (9c:4e:36:c8:b2:94), Dst: Sagemcom_00:48:fc (a0:8e:78:00:48:fc)
Internet Protocol Version 4, Src: 192.168.0.10, Dst: 205.196.120.6
Transmission Control Protocol, Src Port: 64240, Dst Port: 443, Seq: 1, Ack: 1, Len: 0

No.     Time           Source                Destination           Protocol Length Info
     26 18.761803      192.168.0.10          205.196.120.6         TLSv1.2  259    Client Hello

Frame 26: 259 bytes on wire (2072 bits), 259 bytes captured (2072 bits) on interface 0
Ethernet II, Src: IntelCor_c8:b2:94 (9c:4e:36:c8:b2:94), Dst: Sagemcom_00:48:fc (a0:8e:78:00:48:fc)
Internet Protocol Version 4, Src: 192.168.0.10, Dst: 205.196.120.6
Transmission Control Protocol, Src Port: 64240, Dst Port: 443, Seq: 1, Ack: 1, Len: 205
Secure Sockets Layer

No.     Time           Source                Destination           Protocol Length Info
     27 18.890008      205.196.120.6         192.168.0.10          TCP      60     443 → 64240 [ACK] Seq=1 Ack=206 Win=8576 Len=0

Frame 27: 60 bytes on wire (480 bits), 60 bytes captured (480 bits) on interface 0
Ethernet II, Src: Sagemcom_00:48:fc (a0:8e:78:00:48:fc), Dst: IntelCor_c8:b2:94 (9c:4e:36:c8:b2:94)
Internet Protocol Version 4, Src: 205.196.120.6, Dst: 192.168.0.10
Transmission Control Protocol, Src Port: 443, Dst Port: 64240, Seq: 1, Ack: 206, Len: 0

No.     Time           Source                Destination           Protocol Length Info
     28 18.890863      205.196.120.6         192.168.0.10          TLSv1.2  1454   Server Hello

Frame 28: 1454 bytes on wire (11632 bits), 1454 bytes captured (11632 bits) on interface 0
Ethernet II, Src: Sagemcom_00:48:fc (a0:8e:78:00:48:fc), Dst: IntelCor_c8:b2:94 (9c:4e:36:c8:b2:94)
Internet Protocol Version 4, Src: 205.196.120.6, Dst: 192.168.0.10
Transmission Control Protocol, Src Port: 443, Dst Port: 64240, Seq: 1, Ack: 206, Len: 1400
Secure Sockets Layer

No.     Time           Source                Destination           Protocol Length Info
     29 18.890864      205.196.120.6         192.168.0.10          TCP      1422   443 → 64240 [PSH, ACK] Seq=1401 Ack=206 Win=8576 Len=1368 [TCP segment of a reassembled PDU]

Frame 29: 1422 bytes on wire (11376 bits), 1422 bytes captured (11376 bits) on interface 0
Ethernet II, Src: Sagemcom_00:48:fc (a0:8e:78:00:48:fc), Dst: IntelCor_c8:b2:94 (9c:4e:36:c8:b2:94)
Internet Protocol Version 4, Src: 205.196.120.6, Dst: 192.168.0.10
Transmission Control Protocol, Src Port: 443, Dst Port: 64240, Seq: 1401, Ack: 206, Len: 1368

No.     Time           Source                Destination           Protocol Length Info
     30 18.890864      205.196.120.6         192.168.0.10          TCP      1422   443 → 64240 [PSH, ACK] Seq=2769 Ack=206 Win=8576 Len=1368 [TCP segment of a reassembled PDU]

Frame 30: 1422 bytes on wire (11376 bits), 1422 bytes captured (11376 bits) on interface 0
Ethernet II, Src: Sagemcom_00:48:fc (a0:8e:78:00:48:fc), Dst: IntelCor_c8:b2:94 (9c:4e:36:c8:b2:94)
Internet Protocol Version 4, Src: 205.196.120.6, Dst: 192.168.0.10
Transmission Control Protocol, Src Port: 443, Dst Port: 64240, Seq: 2769, Ack: 206, Len: 1368

No.     Time           Source                Destination           Protocol Length Info
     31 18.890866      205.196.120.6         192.168.0.10          TCP      1422   443 → 64240 [PSH, ACK] Seq=4137 Ack=206 Win=8576 Len=1368 [TCP segment of a reassembled PDU]

Frame 31: 1422 bytes on wire (11376 bits), 1422 bytes captured (11376 bits) on interface 0
Ethernet II, Src: Sagemcom_00:48:fc (a0:8e:78:00:48:fc), Dst: IntelCor_c8:b2:94 (9c:4e:36:c8:b2:94)
Internet Protocol Version 4, Src: 205.196.120.6, Dst: 192.168.0.10
Transmission Control Protocol, Src Port: 443, Dst Port: 64240, Seq: 4137, Ack: 206, Len: 1368

No.     Time           Source                Destination           Protocol Length Info
     32 18.890982      192.168.0.10          205.196.120.6         TCP      54     64240 → 443 [ACK] Seq=206 Ack=5505 Win=64240 Len=0

Frame 32: 54 bytes on wire (432 bits), 54 bytes captured (432 bits) on interface 0
Ethernet II, Src: IntelCor_c8:b2:94 (9c:4e:36:c8:b2:94), Dst: Sagemcom_00:48:fc (a0:8e:78:00:48:fc)
Internet Protocol Version 4, Src: 192.168.0.10, Dst: 205.196.120.6
Transmission Control Protocol, Src Port: 64240, Dst Port: 443, Seq: 206, Ack: 5505, Len: 0

No.     Time           Source                Destination           Protocol Length Info
     33 19.011249      205.196.120.6         192.168.0.10          TLSv1.2  71     Certificate, Server Hello Done

Frame 33: 71 bytes on wire (568 bits), 71 bytes captured (568 bits) on interface 0
Ethernet II, Src: Sagemcom_00:48:fc (a0:8e:78:00:48:fc), Dst: IntelCor_c8:b2:94 (9c:4e:36:c8:b2:94)
Internet Protocol Version 4, Src: 205.196.120.6, Dst: 192.168.0.10
Transmission Control Protocol, Src Port: 443, Dst Port: 64240, Seq: 5505, Ack: 206, Len: 17
[5 Reassembled TCP Segments (5422 bytes): #28(1310), #29(1368), #30(1368), #31(1368), #33(8)]
Secure Sockets Layer
Secure Sockets Layer

No.     Time           Source                Destination           Protocol Length Info
     34 19.012681      192.168.0.10          205.196.120.6         TLSv1.2  396    Client Key Exchange, Change Cipher Spec, Encrypted Handshake Message

Frame 34: 396 bytes on wire (3168 bits), 396 bytes captured (3168 bits) on interface 0
Ethernet II, Src: IntelCor_c8:b2:94 (9c:4e:36:c8:b2:94), Dst: Sagemcom_00:48:fc (a0:8e:78:00:48:fc)
Internet Protocol Version 4, Src: 192.168.0.10, Dst: 205.196.120.6
Transmission Control Protocol, Src Port: 64240, Dst Port: 443, Seq: 206, Ack: 5522, Len: 342
Secure Sockets Layer

No.     Time           Source                Destination           Protocol Length Info
     35 19.139449      205.196.120.6         192.168.0.10          TLSv1.2  129    Change Cipher Spec, Encrypted Handshake Message

Frame 35: 129 bytes on wire (1032 bits), 129 bytes captured (1032 bits) on interface 0
Ethernet II, Src: Sagemcom_00:48:fc (a0:8e:78:00:48:fc), Dst: IntelCor_c8:b2:94 (9c:4e:36:c8:b2:94)
Internet Protocol Version 4, Src: 205.196.120.6, Dst: 192.168.0.10
Transmission Control Protocol, Src Port: 443, Dst Port: 64240, Seq: 5522, Ack: 548, Len: 75
Secure Sockets Layer

No.     Time           Source                Destination           Protocol Length Info
     36 19.179399      192.168.0.10          205.196.120.6         TCP      54     64240 → 443 [ACK] Seq=548 Ack=5597 Win=64148 Len=0

Frame 36: 54 bytes on wire (432 bits), 54 bytes captured (432 bits) on interface 0
Ethernet II, Src: IntelCor_c8:b2:94 (9c:4e:36:c8:b2:94), Dst: Sagemcom_00:48:fc (a0:8e:78:00:48:fc)
Internet Protocol Version 4, Src: 192.168.0.10, Dst: 205.196.120.6
Transmission Control Protocol, Src Port: 64240, Dst Port: 443, Seq: 548, Ack: 5597, Len: 0

No.     Time           Source                Destination           Protocol Length Info
     37 19.228745      192.168.0.10          205.196.120.6         TLSv1.2  619    Application Data

Frame 37: 619 bytes on wire (4952 bits), 619 bytes captured (4952 bits) on interface 0
Ethernet II, Src: IntelCor_c8:b2:94 (9c:4e:36:c8:b2:94), Dst: Sagemcom_00:48:fc (a0:8e:78:00:48:fc)
Internet Protocol Version 4, Src: 192.168.0.10, Dst: 205.196.120.6
Transmission Control Protocol, Src Port: 64240, Dst Port: 443, Seq: 548, Ack: 5597, Len: 565
Secure Sockets Layer

No.     Time           Source                Destination           Protocol Length Info
     38 19.362854      205.196.120.6         192.168.0.10          TLSv1.2  491    Application Data

Frame 38: 491 bytes on wire (3928 bits), 491 bytes captured (3928 bits) on interface 0
Ethernet II, Src: Sagemcom_00:48:fc (a0:8e:78:00:48:fc), Dst: IntelCor_c8:b2:94 (9c:4e:36:c8:b2:94)
Internet Protocol Version 4, Src: 205.196.120.6, Dst: 192.168.0.10
Transmission Control Protocol, Src Port: 443, Dst Port: 64240, Seq: 5597, Ack: 1113, Len: 437
Secure Sockets Layer

No.     Time           Source                Destination           Protocol Length Info
     39 19.363045      205.196.120.6         192.168.0.10          TLSv1.2  107    Application Data

Frame 39: 107 bytes on wire (856 bits), 107 bytes captured (856 bits) on interface 0
Ethernet II, Src: Sagemcom_00:48:fc (a0:8e:78:00:48:fc), Dst: IntelCor_c8:b2:94 (9c:4e:36:c8:b2:94)
Internet Protocol Version 4, Src: 205.196.120.6, Dst: 192.168.0.10
Transmission Control Protocol, Src Port: 443, Dst Port: 64240, Seq: 6034, Ack: 1113, Len: 53
Secure Sockets Layer

No.     Time           Source                Destination           Protocol Length Info
     40 19.363079      192.168.0.10          205.196.120.6         TCP      54     64240 → 443 [ACK] Seq=1113 Ack=6087 Win=63658 Len=0

Frame 40: 54 bytes on wire (432 bits), 54 bytes captured (432 bits) on interface 0
Ethernet II, Src: IntelCor_c8:b2:94 (9c:4e:36:c8:b2:94), Dst: Sagemcom_00:48:fc (a0:8e:78:00:48:fc)
Internet Protocol Version 4, Src: 192.168.0.10, Dst: 205.196.120.6
Transmission Control Protocol, Src Port: 64240, Dst Port: 443, Seq: 1113, Ack: 6087, Len: 0

No.     Time           Source                Destination           Protocol Length Info
     41 19.363425      205.196.120.6         192.168.0.10          TCP      60     443 → 64240 [FIN, ACK] Seq=6087 Ack=1113 Win=14125 Len=0

Frame 41: 60 bytes on wire (480 bits), 60 bytes captured (480 bits) on interface 0
Ethernet II, Src: Sagemcom_00:48:fc (a0:8e:78:00:48:fc), Dst: IntelCor_c8:b2:94 (9c:4e:36:c8:b2:94)
Internet Protocol Version 4, Src: 205.196.120.6, Dst: 192.168.0.10
Transmission Control Protocol, Src Port: 443, Dst Port: 64240, Seq: 6087, Ack: 1113, Len: 0

No.     Time           Source                Destination           Protocol Length Info
     42 19.363451      192.168.0.10          205.196.120.6         TCP      54     64240 → 443 [ACK] Seq=1113 Ack=6088 Win=63658 Len=0

Frame 42: 54 bytes on wire (432 bits), 54 bytes captured (432 bits) on interface 0
Ethernet II, Src: IntelCor_c8:b2:94 (9c:4e:36:c8:b2:94), Dst: Sagemcom_00:48:fc (a0:8e:78:00:48:fc)
Internet Protocol Version 4, Src: 192.168.0.10, Dst: 205.196.120.6
Transmission Control Protocol, Src Port: 64240, Dst Port: 443, Seq: 1113, Ack: 6088, Len: 0

No.     Time           Source                Destination           Protocol Length Info
     43 19.364825      192.168.0.10          205.196.120.6         TCP      54     64240 → 443 [FIN, ACK] Seq=1113 Ack=6088 Win=63658 Len=0

Frame 43: 54 bytes on wire (432 bits), 54 bytes captured (432 bits) on interface 0
Ethernet II, Src: IntelCor_c8:b2:94 (9c:4e:36:c8:b2:94), Dst: Sagemcom_00:48:fc (a0:8e:78:00:48:fc)
Internet Protocol Version 4, Src: 192.168.0.10, Dst: 205.196.120.6
Transmission Control Protocol, Src Port: 64240, Dst Port: 443, Seq: 1113, Ack: 6088, Len: 0

No.     Time           Source                Destination           Protocol Length Info
     44 19.364920      192.168.0.10          205.196.120.6         TCP      54     64240 → 443 [RST, ACK] Seq=1114 Ack=6088 Win=0 Len=0

Frame 44: 54 bytes on wire (432 bits), 54 bytes captured (432 bits) on interface 0
Ethernet II, Src: IntelCor_c8:b2:94 (9c:4e:36:c8:b2:94), Dst: Sagemcom_00:48:fc (a0:8e:78:00:48:fc)
Internet Protocol Version 4, Src: 192.168.0.10, Dst: 205.196.120.6
Transmission Control Protocol, Src Port: 64240, Dst Port: 443, Seq: 1114, Ack: 6088, Len: 0

No.     Time           Source                Destination           Protocol Length Info
     45 19.367504      192.168.0.10          205.196.120.6         TCP      66     64242 → 443 [SYN] Seq=0 Win=64240 Len=0 MSS=1460 WS=256 SACK_PERM=1

Frame 45: 66 bytes on wire (528 bits), 66 bytes captured (528 bits) on interface 0
Ethernet II, Src: IntelCor_c8:b2:94 (9c:4e:36:c8:b2:94), Dst: Sagemcom_00:48:fc (a0:8e:78:00:48:fc)
Internet Protocol Version 4, Src: 192.168.0.10, Dst: 205.196.120.6
Transmission Control Protocol, Src Port: 64242, Dst Port: 443, Seq: 0, Len: 0

No.     Time           Source                Destination           Protocol Length Info
     46 19.487107      205.196.120.6         192.168.0.10          TCP      60     443 → 64240 [ACK] Seq=6088 Ack=1114 Win=14125 Len=0

Frame 46: 60 bytes on wire (480 bits), 60 bytes captured (480 bits) on interface 0
Ethernet II, Src: Sagemcom_00:48:fc (a0:8e:78:00:48:fc), Dst: IntelCor_c8:b2:94 (9c:4e:36:c8:b2:94)
Internet Protocol Version 4, Src: 205.196.120.6, Dst: 192.168.0.10
Transmission Control Protocol, Src Port: 443, Dst Port: 64240, Seq: 6088, Ack: 1114, Len: 0

No.     Time           Source                Destination           Protocol Length Info
     47 19.491340      205.196.120.6         192.168.0.10          TCP      62     443 → 64242 [SYN, ACK] Seq=0 Ack=1 Win=64240 Len=0 MSS=1460 SACK_PERM=1

Frame 47: 62 bytes on wire (496 bits), 62 bytes captured (496 bits) on interface 0
Ethernet II, Src: Sagemcom_00:48:fc (a0:8e:78:00:48:fc), Dst: IntelCor_c8:b2:94 (9c:4e:36:c8:b2:94)
Internet Protocol Version 4, Src: 205.196.120.6, Dst: 192.168.0.10
Transmission Control Protocol, Src Port: 443, Dst Port: 64242, Seq: 0, Ack: 1, Len: 0

No.     Time           Source                Destination           Protocol Length Info
     48 19.491464      192.168.0.10          205.196.120.6         TCP      54     64242 → 443 [ACK] Seq=1 Ack=1 Win=64240 Len=0

Frame 48: 54 bytes on wire (432 bits), 54 bytes captured (432 bits) on interface 0
Ethernet II, Src: IntelCor_c8:b2:94 (9c:4e:36:c8:b2:94), Dst: Sagemcom_00:48:fc (a0:8e:78:00:48:fc)
Internet Protocol Version 4, Src: 192.168.0.10, Dst: 205.196.120.6
Transmission Control Protocol, Src Port: 64242, Dst Port: 443, Seq: 1, Ack: 1, Len: 0

No.     Time           Source                Destination           Protocol Length Info
     49 19.491711      192.168.0.10          205.196.120.6         TLSv1.2  291    Client Hello

Frame 49: 291 bytes on wire (2328 bits), 291 bytes captured (2328 bits) on interface 0
Ethernet II, Src: IntelCor_c8:b2:94 (9c:4e:36:c8:b2:94), Dst: Sagemcom_00:48:fc (a0:8e:78:00:48:fc)
Internet Protocol Version 4, Src: 192.168.0.10, Dst: 205.196.120.6
Transmission Control Protocol, Src Port: 64242, Dst Port: 443, Seq: 1, Ack: 1, Len: 237
Secure Sockets Layer

No.     Time           Source                Destination           Protocol Length Info
     50 19.616374      205.196.120.6         192.168.0.10          TCP      60     443 → 64242 [ACK] Seq=1 Ack=238 Win=8576 Len=0

Frame 50: 60 bytes on wire (480 bits), 60 bytes captured (480 bits) on interface 0
Ethernet II, Src: Sagemcom_00:48:fc (a0:8e:78:00:48:fc), Dst: IntelCor_c8:b2:94 (9c:4e:36:c8:b2:94)
Internet Protocol Version 4, Src: 205.196.120.6, Dst: 192.168.0.10
Transmission Control Protocol, Src Port: 443, Dst Port: 64242, Seq: 1, Ack: 238, Len: 0

No.     Time           Source                Destination           Protocol Length Info
     51 19.616910      205.196.120.6         192.168.0.10          TLSv1.2  1454   Server Hello

Frame 51: 1454 bytes on wire (11632 bits), 1454 bytes captured (11632 bits) on interface 0
Ethernet II, Src: Sagemcom_00:48:fc (a0:8e:78:00:48:fc), Dst: IntelCor_c8:b2:94 (9c:4e:36:c8:b2:94)
Internet Protocol Version 4, Src: 205.196.120.6, Dst: 192.168.0.10
Transmission Control Protocol, Src Port: 443, Dst Port: 64242, Seq: 1, Ack: 238, Len: 1400
Secure Sockets Layer

No.     Time           Source                Destination           Protocol Length Info
     52 19.617593      205.196.120.6         192.168.0.10          TCP      1422   443 → 64242 [PSH, ACK] Seq=1401 Ack=238 Win=8576 Len=1368 [TCP segment of a reassembled PDU]

Frame 52: 1422 bytes on wire (11376 bits), 1422 bytes captured (11376 bits) on interface 0
Ethernet II, Src: Sagemcom_00:48:fc (a0:8e:78:00:48:fc), Dst: IntelCor_c8:b2:94 (9c:4e:36:c8:b2:94)
Internet Protocol Version 4, Src: 205.196.120.6, Dst: 192.168.0.10
Transmission Control Protocol, Src Port: 443, Dst Port: 64242, Seq: 1401, Ack: 238, Len: 1368

No.     Time           Source                Destination           Protocol Length Info
     53 19.617674      192.168.0.10          205.196.120.6         TCP      54     64242 → 443 [ACK] Seq=238 Ack=2769 Win=64240 Len=0

Frame 53: 54 bytes on wire (432 bits), 54 bytes captured (432 bits) on interface 0
Ethernet II, Src: IntelCor_c8:b2:94 (9c:4e:36:c8:b2:94), Dst: Sagemcom_00:48:fc (a0:8e:78:00:48:fc)
Internet Protocol Version 4, Src: 192.168.0.10, Dst: 205.196.120.6
Transmission Control Protocol, Src Port: 64242, Dst Port: 443, Seq: 238, Ack: 2769, Len: 0

No.     Time           Source                Destination           Protocol Length Info
     54 19.618983      205.196.120.6         192.168.0.10          TCP      1422   443 → 64242 [PSH, ACK] Seq=2769 Ack=238 Win=8576 Len=1368 [TCP segment of a reassembled PDU]

Frame 54: 1422 bytes on wire (11376 bits), 1422 bytes captured (11376 bits) on interface 0
Ethernet II, Src: Sagemcom_00:48:fc (a0:8e:78:00:48:fc), Dst: IntelCor_c8:b2:94 (9c:4e:36:c8:b2:94)
Internet Protocol Version 4, Src: 205.196.120.6, Dst: 192.168.0.10
Transmission Control Protocol, Src Port: 443, Dst Port: 64242, Seq: 2769, Ack: 238, Len: 1368

No.     Time           Source                Destination           Protocol Length Info
     55 19.618987      205.196.120.6         192.168.0.10          TCP      1422   443 → 64242 [PSH, ACK] Seq=4137 Ack=238 Win=8576 Len=1368 [TCP segment of a reassembled PDU]

Frame 55: 1422 bytes on wire (11376 bits), 1422 bytes captured (11376 bits) on interface 0
Ethernet II, Src: Sagemcom_00:48:fc (a0:8e:78:00:48:fc), Dst: IntelCor_c8:b2:94 (9c:4e:36:c8:b2:94)
Internet Protocol Version 4, Src: 205.196.120.6, Dst: 192.168.0.10
Transmission Control Protocol, Src Port: 443, Dst Port: 64242, Seq: 4137, Ack: 238, Len: 1368

No.     Time           Source                Destination           Protocol Length Info
     56 19.619316      192.168.0.10          205.196.120.6         TCP      54     64242 → 443 [ACK] Seq=238 Ack=5505 Win=64240 Len=0

Frame 56: 54 bytes on wire (432 bits), 54 bytes captured (432 bits) on interface 0
Ethernet II, Src: IntelCor_c8:b2:94 (9c:4e:36:c8:b2:94), Dst: Sagemcom_00:48:fc (a0:8e:78:00:48:fc)
Internet Protocol Version 4, Src: 192.168.0.10, Dst: 205.196.120.6
Transmission Control Protocol, Src Port: 64242, Dst Port: 443, Seq: 238, Ack: 5505, Len: 0

No.     Time           Source                Destination           Protocol Length Info
     57 19.737409      205.196.120.6         192.168.0.10          TLSv1.2  71     Certificate, Server Hello Done

Frame 57: 71 bytes on wire (568 bits), 71 bytes captured (568 bits) on interface 0
Ethernet II, Src: Sagemcom_00:48:fc (a0:8e:78:00:48:fc), Dst: IntelCor_c8:b2:94 (9c:4e:36:c8:b2:94)
Internet Protocol Version 4, Src: 205.196.120.6, Dst: 192.168.0.10
Transmission Control Protocol, Src Port: 443, Dst Port: 64242, Seq: 5505, Ack: 238, Len: 17
[5 Reassembled TCP Segments (5422 bytes): #51(1310), #52(1368), #54(1368), #55(1368), #57(8)]
Secure Sockets Layer
Secure Sockets Layer

No.     Time           Source                Destination           Protocol Length Info
     58 19.738159      192.168.0.10          205.196.120.6         TLSv1.2  396    Client Key Exchange, Change Cipher Spec, Encrypted Handshake Message

Frame 58: 396 bytes on wire (3168 bits), 396 bytes captured (3168 bits) on interface 0
Ethernet II, Src: IntelCor_c8:b2:94 (9c:4e:36:c8:b2:94), Dst: Sagemcom_00:48:fc (a0:8e:78:00:48:fc)
Internet Protocol Version 4, Src: 192.168.0.10, Dst: 205.196.120.6
Transmission Control Protocol, Src Port: 64242, Dst Port: 443, Seq: 238, Ack: 5522, Len: 342
Secure Sockets Layer

No.     Time           Source                Destination           Protocol Length Info
     59 19.869786      205.196.120.6         192.168.0.10          TLSv1.2  129    Change Cipher Spec, Encrypted Handshake Message

Frame 59: 129 bytes on wire (1032 bits), 129 bytes captured (1032 bits) on interface 0
Ethernet II, Src: Sagemcom_00:48:fc (a0:8e:78:00:48:fc), Dst: IntelCor_c8:b2:94 (9c:4e:36:c8:b2:94)
Internet Protocol Version 4, Src: 205.196.120.6, Dst: 192.168.0.10
Transmission Control Protocol, Src Port: 443, Dst Port: 64242, Seq: 5522, Ack: 580, Len: 75
Secure Sockets Layer

No.     Time           Source                Destination           Protocol Length Info
     60 19.870785      192.168.0.10          205.196.120.6         TLSv1.2  651    Application Data

Frame 60: 651 bytes on wire (5208 bits), 651 bytes captured (5208 bits) on interface 0
Ethernet II, Src: IntelCor_c8:b2:94 (9c:4e:36:c8:b2:94), Dst: Sagemcom_00:48:fc (a0:8e:78:00:48:fc)
Internet Protocol Version 4, Src: 192.168.0.10, Dst: 205.196.120.6
Transmission Control Protocol, Src Port: 64242, Dst Port: 443, Seq: 580, Ack: 5597, Len: 597
Secure Sockets Layer

No.     Time           Source                Destination           Protocol Length Info
     61 20.023501      205.196.120.6         192.168.0.10          TLSv1.2  395    Application Data

Frame 61: 395 bytes on wire (3160 bits), 395 bytes captured (3160 bits) on interface 0
Ethernet II, Src: Sagemcom_00:48:fc (a0:8e:78:00:48:fc), Dst: IntelCor_c8:b2:94 (9c:4e:36:c8:b2:94)
Internet Protocol Version 4, Src: 205.196.120.6, Dst: 192.168.0.10
Transmission Control Protocol, Src Port: 443, Dst Port: 64242, Seq: 5597, Ack: 1177, Len: 341
Secure Sockets Layer

No.     Time           Source                Destination           Protocol Length Info
     62 20.023843      205.196.120.6         192.168.0.10          TLSv1.2  107    Application Data

Frame 62: 107 bytes on wire (856 bits), 107 bytes captured (856 bits) on interface 0
Ethernet II, Src: Sagemcom_00:48:fc (a0:8e:78:00:48:fc), Dst: IntelCor_c8:b2:94 (9c:4e:36:c8:b2:94)
Internet Protocol Version 4, Src: 205.196.120.6, Dst: 192.168.0.10
Transmission Control Protocol, Src Port: 443, Dst Port: 64242, Seq: 5938, Ack: 1177, Len: 53
Secure Sockets Layer

No.     Time           Source                Destination           Protocol Length Info
     63 20.023844      205.196.120.6         192.168.0.10          TCP      60     443 → 64242 [FIN, ACK] Seq=5991 Ack=1177 Win=14328 Len=0

Frame 63: 60 bytes on wire (480 bits), 60 bytes captured (480 bits) on interface 0
Ethernet II, Src: Sagemcom_00:48:fc (a0:8e:78:00:48:fc), Dst: IntelCor_c8:b2:94 (9c:4e:36:c8:b2:94)
Internet Protocol Version 4, Src: 205.196.120.6, Dst: 192.168.0.10
Transmission Control Protocol, Src Port: 443, Dst Port: 64242, Seq: 5991, Ack: 1177, Len: 0

No.     Time           Source                Destination           Protocol Length Info
     64 20.023935      192.168.0.10          205.196.120.6         TCP      54     64242 → 443 [ACK] Seq=1177 Ack=5992 Win=63754 Len=0

Frame 64: 54 bytes on wire (432 bits), 54 bytes captured (432 bits) on interface 0
Ethernet II, Src: IntelCor_c8:b2:94 (9c:4e:36:c8:b2:94), Dst: Sagemcom_00:48:fc (a0:8e:78:00:48:fc)
Internet Protocol Version 4, Src: 192.168.0.10, Dst: 205.196.120.6
Transmission Control Protocol, Src Port: 64242, Dst Port: 443, Seq: 1177, Ack: 5992, Len: 0

No.     Time           Source                Destination           Protocol Length Info
     65 20.028126      192.168.0.10          205.196.120.6         TCP      54     64242 → 443 [FIN, ACK] Seq=1177 Ack=5992 Win=63754 Len=0

Frame 65: 54 bytes on wire (432 bits), 54 bytes captured (432 bits) on interface 0
Ethernet II, Src: IntelCor_c8:b2:94 (9c:4e:36:c8:b2:94), Dst: Sagemcom_00:48:fc (a0:8e:78:00:48:fc)
Internet Protocol Version 4, Src: 192.168.0.10, Dst: 205.196.120.6
Transmission Control Protocol, Src Port: 64242, Dst Port: 443, Seq: 1177, Ack: 5992, Len: 0

No.     Time           Source                Destination           Protocol Length Info
     66 20.028338      192.168.0.10          205.196.120.6         TCP      54     64242 → 443 [RST, ACK] Seq=1178 Ack=5992 Win=0 Len=0

Frame 66: 54 bytes on wire (432 bits), 54 bytes captured (432 bits) on interface 0
Ethernet II, Src: IntelCor_c8:b2:94 (9c:4e:36:c8:b2:94), Dst: Sagemcom_00:48:fc (a0:8e:78:00:48:fc)
Internet Protocol Version 4, Src: 192.168.0.10, Dst: 205.196.120.6
Transmission Control Protocol, Src Port: 64242, Dst Port: 443, Seq: 1178, Ack: 5992, Len: 0

No.     Time           Source                Destination           Protocol Length Info
     67 20.033832      192.168.0.10          205.196.120.6         TCP      66     64244 → 80 [SYN] Seq=0 Win=64240 Len=0 MSS=1460 WS=256 SACK_PERM=1

Frame 67: 66 bytes on wire (528 bits), 66 bytes captured (528 bits) on interface 0
Ethernet II, Src: IntelCor_c8:b2:94 (9c:4e:36:c8:b2:94), Dst: Sagemcom_00:48:fc (a0:8e:78:00:48:fc)
Internet Protocol Version 4, Src: 192.168.0.10, Dst: 205.196.120.6
Transmission Control Protocol, Src Port: 64244, Dst Port: 80, Seq: 0, Len: 0

No.     Time           Source                Destination           Protocol Length Info
     68 20.040534      192.168.0.10          69.16.175.10          TCP      66     64245 → 80 [SYN] Seq=0 Win=64240 Len=0 MSS=1460 WS=256 SACK_PERM=1

Frame 68: 66 bytes on wire (528 bits), 66 bytes captured (528 bits) on interface 0
Ethernet II, Src: IntelCor_c8:b2:94 (9c:4e:36:c8:b2:94), Dst: Sagemcom_00:48:fc (a0:8e:78:00:48:fc)
Internet Protocol Version 4, Src: 192.168.0.10, Dst: 69.16.175.10
Transmission Control Protocol, Src Port: 64245, Dst Port: 80, Seq: 0, Len: 0

No.     Time           Source                Destination           Protocol Length Info
     69 20.053846      69.16.175.10          192.168.0.10          TCP      66     80 → 64245 [SYN, ACK] Seq=0 Ack=1 Win=14600 Len=0 MSS=1460 SACK_PERM=1 WS=512

Frame 69: 66 bytes on wire (528 bits), 66 bytes captured (528 bits) on interface 0
Ethernet II, Src: Sagemcom_00:48:fc (a0:8e:78:00:48:fc), Dst: IntelCor_c8:b2:94 (9c:4e:36:c8:b2:94)
Internet Protocol Version 4, Src: 69.16.175.10, Dst: 192.168.0.10
Transmission Control Protocol, Src Port: 80, Dst Port: 64245, Seq: 0, Ack: 1, Len: 0

No.     Time           Source                Destination           Protocol Length Info
     70 20.054107      192.168.0.10          69.16.175.10          TCP      54     64245 → 80 [ACK] Seq=1 Ack=1 Win=65536 Len=0

Frame 70: 54 bytes on wire (432 bits), 54 bytes captured (432 bits) on interface 0
Ethernet II, Src: IntelCor_c8:b2:94 (9c:4e:36:c8:b2:94), Dst: Sagemcom_00:48:fc (a0:8e:78:00:48:fc)
Internet Protocol Version 4, Src: 192.168.0.10, Dst: 69.16.175.10
Transmission Control Protocol, Src Port: 64245, Dst Port: 80, Seq: 1, Ack: 1, Len: 0

